122,Solar Energy for Women__ Empowerment in Burundi,https://my.southsouth-galaxy.org/en/solutions/detail/solar-energy-for-womens-empowerment-in-burundi,"The project aimed to promote the use of solar energy by women's groups in rural areas for income-generating activities and improved access to basic services. The project includes an exploration of SSC exchanges (no detailed information) relevant to energy solutions. Part of the project strategy was the mobilization of funds from triangular partners, including stakeholder engagement, for example with Swiss Cooperation Agency and The European Union as energy solutions and women__ empowerment align with their priorities.",BDI,"BDI,CHE","Africa,Europe","United Nations Development Programme (UNDP),Ministry of Energy of Burundi,Ministry of Gender of Burundi,FVS AMADE, Swiss Cooperation Agency and the EU",,,,,2018,2019,"Energy,Gender Equality",,SDG7,"SDG1,SDG4,SDG5,SDG7,SDG8,SDG17"
123,South-South Exchanges for Accelerating the Implementation of African Union Treaties in São Tomé and Príncipe,https://my.southsouth-galaxy.org/en/solutions/detail/south-south-exchanges-for-accelerating-the-implementation-of-african-union-treaties-in-sao-tome-and-principe,"The project aimed to promote peer learning and knowledge sharing among African countries for the effective implementation of African Union treaties.This South-South initiative was implemented by the Government of Benin, the Government of São Tomé and Príncipe and UNDP country offices in São Tomé and Príncipe and Benin. The main objective of this three-day South-South exchange visit was to gather inputs from the recognized Beninese experience in the domestication and implementation of regional treaties.",STP,"BEN,SWE","Africa,Europe","Government of Sweden,UNDP Regional Bureau for Africa,Government of São Tomé and Príncipe,Government of Benin,UNDP in Benin and São Tomé and Príncipe",,YES,YES,,2018,2021,Governance,,SDG16,"SDG5,SDG17"
124,Support to the new Parliament of Sierra Leone,https://my.southsouth-galaxy.org/en/solutions/detail/support-to-the-new-parliament-of-sierra-leone-1,"The project aimed to strengthen the capacity of the newly elected Parliament of Sierra Leone to fulfill its legislative, representation, and oversight functions effectively. There were  South-South exchanges between Kenya and Sierra Leone, the organigramme of the Sierra Leonean Parliament has been restructured, resulting in proper line management of staff and the recruitment of sergeant-at-arms personnel for managing the facilities of the Parliament. There was an induction programme for the new parliamentarians, conducted in May 2018 in partnership with Westminster Foundation (UK), and a peer-learning visit undertaken in November 2018 to the Parliament of Kenya.",SLE,"KEN,GBR","Africa,Europe","UNDP,Parliament of Sierra Leone",YES,YES,,,2018,2019,Governance,,SDG16,SDG17
125,The Lesotho Data for Sustainable Development,https://my.southsouth-galaxy.org/en/solutions/detail/the-lesotho-data-for-sustainable-development,"The project aimed to promote evidence-based decision-making in Lesotho through the collection, analysis, and dissemination of data for sustainable development.The project has promoted a series of thematic visits and short courses in other African countries. Leostho Bureau of Statistics incorporated many lessons learned through these South-South knowledge- and experience-exchange activities from Mauritius, South Africa, Uganda. For example, it has revised its tools for the planned agricultural census, updated methodological aspects of the CPI__ calculation and produced Lesotho__ first report on PPI. Moreover, to address challenges related to access to data, the BOS has upgraded its Open Data Portal (with the support of the African Development Bank), thus facilitating the production of customized reports, analysis and disaggregation, and enabling the development of district-specific data profiles. UNDP and the EU supported the project.",LSO,"MUS,ZAF,UGA","Africa,Europe","European Commission and UNDP,Ministry of Development Planning of Lesotho,through the Bureau of Statistics (BOS) and the Department of Monitoring and Evaluation",,YES,,,2016,2019,"Governance,Digitalization",,SDG16,SDG17
126,Urban Resilience,https://my.southsouth-galaxy.org/en/solutions/detail/urban-resilience,"The project aimed to build the resilience of cities in Africa and Asia to climate change and other shocks through urban planning and infrastructure improvements. The programme is very much oriented towards South-South and Triangular cooperation. Achieving desired outcomes and maximizing the results would be impossible without learning from other countries_ experiences on urban resilience building initiatives and creating new partnerships that will enrich the implementation of the programme. As one of the aspects of South-South cooperation, the project studied the successful experience of South Africa and Tunisia in the establishment of entrepreneurship building centres for youth in cooperation with private sector (HP Life Foundation) and the UN agencies.",ZWE,"ZAF,TUN",Africa,"UNDP Country Investment Facility,UNDP Zimbabwe,Ministry of Local Government,Public Works and National Housing,Selected local authorities,Ministry of Industry,Commerce and Enterprise Development,Ministry of Women Affairs,Ministry of Youth and Sports,Ministry of Environment,Water and Climate.",YES,,YES,,2018,2019,"Resilience,Environment",Infrastructure,SDG11,SDG17
127,Regional Basel Convention Center - Project ID: 00064373 / Output ID: 0081213,https://open.undp.org/projects/00064373,"Inadequate hazardous waste (HW) management in most of the 22 Arab countries served by the Basel Convention Regional Centre for Training and Technology Transfer for Arab States in Egypt (BCRC-Egypt) generates considerable public health and environmental problems, including contamination of soil and water. The project's main goal is to develop BCRC-Egypt into a sustainable regional knowledge and service centre on HW issues for Arabic-speaking countries. The project comprises four components based on the types of services provided to member countries: 1: Training services, 2: Technical assistance on HW management, 3: Knowledge sharing with Arab Countries, 4: Capacity building in HW identification. The institutional development of BCRC-Egypt constitutes a fifth output. Egypt functions as a capacity builder to implement this project in Arab States (Tunisia, Syria, Sudan, Somalia, Morocco, Mauritania, Libya, Lebanon, Kuwait, Jordan, Iraq) through Convening / Partnerships / Knowledge Sharing Capacity Development / Technical Assistance.","TUN,SYR,SDN,SOM,MAR,MRT,LBY,LBN,KWT,JOR,IRQ","EGY,FIN","MENA,Europe","Basel Convention Regional Center,UNDP,Government of Finland",,YES,YES,,2012,2019,"Health,Environment",,SDG12,"SDG15,SDG3,SDG17"
128,BRA/14/010 - SSC Africa  Social Protection and Gender - Project ID: 00084932 / Output ID: 0092729,https://open.undp.org/projects/00084932,"This project is intended to increase Brazil's engagement in international development cooperation partnerships with Low-Income Countries (LIC) in Africa. The central objective is to contribute to poverty eradication 2 and inclusive socio-economic development in target countries while promoting gender equality and the empowerment of women, with a focus on ending violence against women and increasing their economic inclusion. Some initiative in this project such as the Milk Bank contributes to HIV+ mothers to breastfeeding children (reduce child mortality and nutrition problems) and access to labour without affacting children.The idea of the project is to allow Brazilian experiences and expertise, mainly in the field of social protection and empowerment of women (maternal health), to be shared especially to those African countries that have demanded for it, aiming at producing sustainable results. Brazil functions as a capacity builders to implement this project in Mozambique, through Policy Advice, Innovative Approaches, Institutional Mechanism and System Building, Direct support / Service Delivery, Capacity Development / Technical Assistance. Further details are in the link.",MOZ,BRA,"LAC,Africa","UNDP,UN Women,UNFPA,International Policy Centre for Inclusive Growth",,YES,YES,,2015,2018,"Health,Gender Equality,Poverty and Inequality","Social Protection,Youth",SDG1 ,"SDG10,SDG17,SDG3"
129,GEF Chemicals and Pollutants - Project ID:  00100779 / Output ID: 0103569,https://open.undp.org/projects/00100779,"The project is to protect human health and the global environment from the impact of harmful chemicals, particularly Persistent Organic Pollutants (POPs) and mercury (Hg). Ecuador and GEF-GOLD (https://www.thegef.org/newsroom/multimedia/gef-gold-program) participating countries (Burkina Faso (UNIDO), Colombia (UNDP), Guyana (Conservation International), Indonesia (UNDP), Kenya (UNDP), Mongolia (UNEP/UNIDO), Peru (UNDP) and the Philippines (UNEP/UNIDO), are involved in the project in Ecuador. Results, lessons learned, and experiences of the Ecuador project will be directly incorporated into the global component of GEF-GOLD, on communications and knowledge management (administered by UNEP). UNDP ASM (small-scale mining) use the experience of an ASM project in another country (for example, exchanging national experts) to ensure coherence and consistency. Also, UNDP annually organizes face-to-face SSC exchange workshops among all UNDP/GEF chemicals and waste projects in the LAC, such as Colombia, Honduras and Uruguay, focusing on various POPs and Hg issues.","ECU,COL,HND,URY","BFA,COL,GUY,IDN,KEN,MNG,PER,PHL","LAC,Asia Pacific","UNDP,Government of Ecuador,GEF-GOLD Countries",,,YES,,2018,2023,"Health,Environment",,SDG12,"SDG13,SDG15,SDG3,SDG17"
130,Health Governance Initiative (HEART) - Project ID: 00106768 / Output ID: 00107345 ,https://open.undp.org/projects/00106768,"The project aimed to support government of Indonesia to increase capacity and stimulate other actors to find innovative and sustainable solutions to health system challenges and provide management support and technical assistance for the health program in Indonesia.The programme implementes South-South and triangular cooperation across all its activities. The work related to enabling policy and institutional environments benefits directly from UNDP Access Delivery and Partnership which brings Indonesia, Thailand, Ghana and Tanzania together. The eVIN/SMILE (Electronic Vaccine Intelligence Network/ Sistem Monitoring Informasi Logistik secara Elektronik) technology for improved supply chains stems directly from a South-South Cooperation project with India. The work related to procurement, supply chains more broadly and capacity development for programme implementation draws heavily on UNDP's engagement with the Global Fund over 25 countries. The programme also benefits from SSTC facilitated by UNDP Regional Hub (Bangkok) as well as BPPS (HQ). Japan, Australia and US supported this project.","IDN,THA,GHA,TZA","IND,AUS,JPN,USA","Asia Pacific,Africa,North America","Indonesia: Ministry of Health,Local governments,iNGOs,Global Environment Facility,The Global Fund to AIDS,Malaria,TB,GAVI,WHO,UNAIDS,Australia Department of Foreign Affairs and Trade",,YES,YES,YES,2017,2024,"Health,Governance",,SDG3,SDG17
131,Electronic Health Intelligence Network Initiation Plan - Project ID: 00121496 / Output ID: 00117213,https://open.undp.org/projects/00121496,"The Electronic  Health Information Network (e-HIN) was developed to provide visibility into the health supply chain at facility and community levels. There are successes achieved and challenges overcome through the launch of electronic Vaccine Intelligence: Network (eVIN) in India.: The project adaptd from the Network implemented in India, and Sudan. South-South exchanges with UNDP India and the Indian government are therefore anticipated as the project moves forward. Malawi was the first Sub-Saharan African country to adapt this system (and second in Africa after Sudan), it is envisaged that to share experiences and lessons learnt with neighbouring countries facing similar challenges of leakage and theft of health products India functions as a capacity builder to implement this project in Malawi through Institutional Mechanism and System Building, Direct support / Service Delivery, Capacity Development / Technical Assistance. ","MWI,SDN",IND,"Asia Pacific,Africa","Government of India,UNDP,WHO,UNAIDS,UNFPA,GHSC,USAID,UNICF,Government of Australia,US,Norway,Germany",,YES,YES,YES,2019,2022,"Health,Governance",,SDG16,"SDG3,SDG17"
132,SSCAF Umbrella Project - Project ID 00124481 / Output ID: 00129328,https://open.undp.org/projects/00124481,"This project is about decent work for people with disabilities in Turkmenistan: transforming social enterprises into meaningful training and employment opportunities. The ultimate goal of the project is to promote the employment of persons with disabilities in Skmenistan and increase their income sources through vocational training and job creation. This project is committed to three aspects. First, it aims to promote the modernization of the three social enterprises; second, it focuses on promoting the development of the Turkmenistan Association of the Blind and Deaf to better serve its members; third Facilitate disability awareness and implementation capacity among other stakeholders, e.g. vocational schools, private sector representatives and policy makers.  During the implementation of the project, the Skurmenistan Association of the Blind and Deaf-Mute and similar disabled organizations in China has conducted peer learning and knowledge exchange, and Chinese experts and producers will also be invited to participate in the project.",TKM,CHN,Asia Pacific,"Government of China,Government of Turkmenistan ",YES,,YES,,2020,2023,Health,Job Creation,SDG17,"SDG3,SDG17"
133,SDGIA Phase II with UNTB - Project ID: 00125892 / Output ID: 00120089,https://open.undp.org/projects/00125892,"The overall objective of the project is to replicate SDG Impact Accelerator Initiative in Turkey which was first tested in 2019 under the leadership of MFA and UNDP in collaboration of strong Government, UN and private sector partners. The Project replicated accelerator program in Bangladesh and Uganda with corresponding priority challenge areas on Digital Health and Financial Inclusion. The project contributed to the establishment of partnerships on STI between LDCs and Turkey while supporting internal capacities in respective pilot countries. Overall intervention has  benefitted SSC and TrC perspectives since the Project targets to establish a system via SDG Accelerator to ultimately serve LDCs with a global perspective on digital health and financial inclusion, an action-oriented SST/TrC Strategy is already embedded in strategy/approach of the intervention.",TUR,"UGA,BGD","Asia Pacific,Africa,MENA","UNDP,Government of Turkey",YES,YES,YES,,2020,2022,"Health,Agriculture and Food Security",,SDG2,"SDG17,SDG3"
134,COVID19 Medical Waste Management - Project ID: 00127382 / Output ID: 00121262,https://open.undp.org/projects/00127382,"China__ experiences and approaches in responding to COVID-19 hold critically important lessons for other countries - to prepare health systems for a spike in demand, to inform the public, and to slow the transmission of the disease. The goals of the project are i) to strengthen the preparedness and responding capacity at Asia-Pacific regional level with a special focus on COVID-19 in Myanmar, and ii) to share China__ successful experiences and establish regional connectivity within and beyond the project partner countries for sustainable cooperation on COVID-19 response and related through South-South cooperation. China is a capacity builder to strengthen COVID-19 medical waste management in Myanmar through Support Functions, Capacity Development / Technical Assistance, and Direct support / Service Delivery. Further details are in the link.""",MMR,CHN,Asia Pacific,"UNDP,Chinese Ministry of Ecology and Environment. Chinese National Health Commission,Tsinghua Univeristy/Basel Convention Regional Center for Asia and the Pacific,Ministry of Health and Sports (MoHS),Myanmar,Yangon City Development Committee ",,YES,YES,,2021,2023,"Health,Environment",,SDG3,"SDG13,SDG17"
135,Response to COVID-19 in Asia and the Pacific Region - Project ID: 00131220 / Output ID: 00124332,https://open.undp.org/projects/00131220,"China__ experiences and approaches in responding to COVID-19 hold critically important lessons for other countries - to prepare health systems for a spike in demand, to inform the public, and to slow the transmission of the disease. The goals of the project are i) to strengthen the preparedness and responding capacity at Asia-Pacific reginal level with special focus on COVID-19 in Philippines, and ii) share China__ successful experiences and establish regional connectivity within and beyond the project partner countries for sustainable cooperation on COVID-19 response and related through South-South cooperation. China functions as capacity builder to implement this project in Philippines through Support Functions, Capacity Development / Technical Assistance, Direct support / Service Delivery. Further details are in the link. ",PHL,CHN,Asia Pacific,"United Nations Development Programme,Chinese Ministry of Ecology and Environment. Chinese National Health Commission,Tsinghua Univeristy/Basel Convention Regional Center for Asia and the Pacific,Philippines: Department of Health (DOH),Department of Environment and Natural Resources (DENR),Health Care Without Harm (HCWH)",,,YES,,2021,2022,"Health,Agriculture and Food Security",,SDG2,"SDG13,SDG1,SDG3,SDG17"
136,Response to COVID-19 in Asia and the Pacific Region - Project ID: 00132932 / Output ID: 00125223,https://open.undp.org/projects/00132932,"China__ experiences and approaches in responding to COVID-19 hold critically important lessons for other countries - to prepare health systems for a spike in demand, to inform the public, and to slow the transmission of the disease. The goals of the project are i) to strengthen the preparedness and responding capacity at Asia-Pacific regional level with a special focus on Laos, Philippines, Cambodia, Myanmar and Nepal to COVID-19, and ii) to share China__ successful experiences and establish regional connectivity within and beyond the project partner countries for sustainable cooperation on COVID-19 response and related through South-South cooperation. ","LAO,PHL,KHM,MMR,NPL",CHN,Asia Pacific,"UNDP,WHO,Governments (Ministries of Health),Private Sector,Civil Society Organizations,Tsinghua University,Chinese Ministry of Ecology and Environment """,YES,YES,YES,,2020,2023,"Health,Agriculture and Food Security",,SDG2,"SDG17,SDG9,SDG3"
137,Medical Waste Management-CoVID19 - Project ID: 00133431 / Output ID: 00125406,https://open.undp.org/projects/00133431,"China__ experiences and approaches in responding to COVID-19 hold critically important lessons for other countries - to prepare health systems for a spike in demand, to inform the public, and to slow the transmission of the disease. The goals of the project are i) to strengthen the preparedness and responding capacity at Asia-Pacific regional level with a special focus on COVID-19 in Cambodia, and ii) to share China__ successful experiences and establish regional connectivity within and beyond the project partner countries for sustainable cooperation on COVID-19 response and related through South-South cooperation. China functions as capacity builder to implement this project in Cambodia through Support Functions, Capacity Development / Technical Assistance, Direct support / Service Delivery. Further details are in the link.  ",KHM,CHN,Asia Pacific,"UNDP,WHO,Government of China,China International Centre For Economic & Technical Exchanges,Government of Cambodia,Cambodian Ministry of Health",,YES,YES,YES,2021,2023,Health,,SDG3,"SDG10,SDG1,SDG17"
138,Improvement of Infectious Waste Mgt. in SW Asia. - Project ID: 00146164 / Output ID: 00133358,https://open.undp.org/projects/00146164,"This project supported national governments, health agencies and stakeholders in three countries (Bangladesh, Bhutan, and the Maldives) in Southwest Asia by deploying locally appropriate and gender responsive healthcare waste management practices and technologies. It also improved the capacity of healthcare institutions (i) to address both infectious and non-infectious healthcare waste, (ii) to protect human health, and (iii) to minimize the environmental and social impacts.Funded by Japan (TrC), the project also contributed to South-South learning and the sharing of knowledge, skills, good practices, and expertise across the region and globally. The project strengthened healthcare waste management policies and include innovative digital technology and renewable/green energy. This project also sought to learn from and collaborate with the ongoing regional ""Learning from China's Experience to Improve the Ability of Response to COVID-19 in Asia and the Pacific Region"" (GDF) project. UNDP BRH has been conducting regional research to better understand the most pressing issues for HCWM in five project countries (Cambodia, Lao PDR, Myanmar, Nepal, and the Philippines). ","BGD,BTN,MDV,LAO,PHL,NPL,KHM,MMR","JPN,CHN",Asia Pacific,"UNDP,NGOs,CSOs,Government of Bhutan,Bangladesh,Maldives,Government of Japan and China",,YES,YES,,2022,2024,"Health,Gender Equality,Energy,Environment",,SDG3,"SDG16 ,SDG17"
139,Rural communities in Haiti gain access to water through solar water pumps,"https://indiaunfund.unsouthsouth.org/#publications, https://unsouthsouth.org/2023/02/22/rural-communities-in-haiti-gain-access-to-water-through-solar-water-pumps/","The India-UN Fund-supported project seeks to provide access to safe drinking water for 40,000 people, over half of whom are women and girls in the rural areas of Aquin and Baconnois, through the installation of 8 solar photovoltaic-based water pumping systems aimed to reduce greenhouse gas emissions. More than 20 women and men in these communities will receive vocational training on the operation and maintenance of the systems. Financed by the India-UN Development Partnership Fund, and jointly implemented by UNDP and Haiti__ Ministry of the Environment, with Indian company's involvement.	  ",HTI,IND,"Asia Pacific,LAC","UNDP,Government of Haiti,Shakti Pumps (Indian firm,),and Haitian technicians",YES,YES,YES,YES,2020,,"Energy,Gender Equality,Environment",,SDG6,"SDG7,SDG2,SDG17"
140,Samoa Digital Library launched at NUS,https://www.undp.org/samoa/press-releases/samoa-digital-library-launched-nus,"Samoa Digital Library launched at NUS, and the national digital library aims to increase access to bibliographic and institutional information from Samoa in English and Samoan. Financed by the India-UN Development Partnership Fund, and jointly implemented by UNDP and the Government of Samoa.",WSM,IND,Asia Pacific,"UNDP,Government of Samoa,Government of India",,,YES,YES,2022,,"Digitalization,Governance",,SDG4,"SDG11,SDG17"
141,Global Sustainable Supply Chains For Marine Commodities - Project ID: 00083787 / Output ID: 00092092,https://open.undp.org/projects/00083787,"This project contributed to address key aspects of the market forces that drive overfishing. The project added to the transformation of the seafood market by mainstreaming sustainability in the value chain of important commodities from developing countries, improving emerging tools such as corporate sustainable purchase policies, sustainable marine commodities platforms, and fisheries improvement projects (FIP), developing national capacities, and generating learning to be shared worldwide. The project adapted the concept of green commodities platforms (currently used in agriculture) to the seafood value chain, implement public-private sustainable marine commodities platforms in Costa Rica, Ecuador, Indonesia and Philippines to generate experience that could be used in other countries. Ecuador has extensive experience in the preparation and implementation of SFAPs used for South-South Cooperation.","ECU,CRI,IDN,PHL",ECU,"Asia Pacific,LAC","The Bureau of Fisheries and Aquatic Resources of Philippines,Sustainable Fisheries Partnership",YES,,YES,YES,2017,2022,Agriculture and Food Security,,SDG2,"SDG14,SDG15,SDG17"
142,Strengthening the institutional capacity of the Ombudsperson__ Office of Turkmenistan,https://www.undp.org/turkmenistan/projects/strengthening-institutional-capacity-ombudspersons-office-turkmenistan,"The main goal of the project is the improvement of the system of protection, promotion and implementation of human rights in Turkmenistan by reforming national legislation in accordance with the human rights obligations of Turkmenistan international, as well as increasing the institutional capacity of the Ombudsperson__ Office. In particular, UNDP supported Turkmenistan in the regional interactive dialogue __omen and Girls_ sexual and reproductive health rights in Crisis_. The Annual General Meeting of the Asia Pacific Forum (APF) is a meeting of Councilors and APF members to share knowledge and discuss matters of mutual interest between member institutions and to communicate with partners and other interested stakeholders, including the participants from Afghanistan, India, Qatar, and others.",TKM,"AFG,IND,QAT","MENA,Asia Pacific","UNDP, Government of Afghanistan,India,Qatar and other Asia-Pacific Countries",,YES,YES,,2021,,"Health,Governance,Gender Equality",,SDG16,"SDG5,SDG3,SDG17"
