Number,Project Name,Links,Description,Host/Recipient Country/ies,Provider Country/ies,Regions Involved,Entity/ies Supporting and/or Implementing,Is the private sector involved?,Does it involve LDCs?,UNDP as Implementor,UNDP as Donor,Start year,End year,Thematic Areas,Sub-thematic areas,Primary SDG Contribution,Secondary SDG Contribution
1,Chile Fund against Hunger and Poverty,"https://my.southsouth-galaxy.org/en/solutions/detail/chile-fund-against-hunger-and-poverty,https://fondochile.cl/","The project aimed to alleviate poverty and hunger primarily in Chile by financing and supporting projects that promote sustainable livelihoods, social protection, and food security for vulnerable populations. The fund also works to strengthen local capacities, promote participation and collaboration among different actors, and provide technical assistance and knowledge exchange with other countries. The Government of Chile shared its social and economic transformation experience with other countries (Gaza, Mali, South Sudan, and over 30 countries) through South-South cooperation that can accelerate social and economic progress.The Fund has awarded over $12 million to 82 South-South cooperation projects in over 30 countries in Africa, LAC, and the Pacific. ",,CHL,"Africa,LAC,Asia Pacific",Government of Chile (Chilean International Cooperation Agency),,YES,,,2011,2016,"Agriculture and Food Security,Poverty and Inequality",Social Protection,SDG2,"SDG2,SDG17"
2,Industrialization and Job Creation for Africa ,https://my.southsouth-galaxy.org/en/solutions/detail/industrialization-and-job-creation-for-africa,"The project aimed to promote sustainable industrialization and job creation in Africa by enhancing regional cooperation, attracting investment, and strengthening local capacities. The initiative focuses on developing key sectors such as agro-processing, light manufacturing, and renewable energy, and provides technical assistance, knowledge exchange, and financing to support industrialization and job creation efforts. The partnership in this project are built on collaboration between African countries (Ethiopia, Djibouti, Nigeria) with comparative advantages in the supply of labour and raw materials to attract investors from emerging economies with manufacturing capability and international buyers/retailers in Europe and the United States. UNDP China signed a memorandum of understanding with the Made in Africa Initiative in 2015 to build on early success. The Centre for New Structural Economics at Peking University and the Made in Africa Initiative are working with UNDP to leverage its global network and convening power to advance the agenda of pan-African industrialization. Chinese companies participated in the project to make Africa the next manufacturing hub for global markets by helping it to seize the opportunity for industrialization arising from the relocation of light manufacturing from China. ","ETH,DJI,NGA",CHN,"Africa,Asia Pacific","UNDP,UNIDO,Made in Africa Initiative,Centre for New Structural Economics at Peking University,African Governments,Companies.",YES ,YES,YES,,2011,2016,Energy,Job Creation,SDG1 ,"SDG8,SDG9,SDG17"
3,New Rice for Africa (NERICA) ,https://my.southsouth-galaxy.org/en/solutions/detail/new-rice-for-africa-nerica,"The project aimed to improve food security and livelihoods in Africa by developing and promoting new rice varieties that are high-yielding, disease-resistant, and adapted to local conditions. It also provided technical assistance, capacity building, and knowledge exchange to support the development and dissemination of NERICA varieties, which have been shown to increase rice productivity and incomes for smallholder farmers. Regular field visits are organized to build farmers_ capacities. Knowledge and information about technologies are shared among farmers on a regular basis. Financial and market risk implications are analysed. Rural knowledge centres are set up to facilitate peer learning among farmers from neighbouring communities with similar land conditions. Japan funded the project.","BEN,BFA,CMR,CAF,TCD,CIV,COD,EGY,GAB,GMB,GHA,GIN,GNB,LBR,MDG",JPN,"Asia Pacific,MENA,Africa","Japan,UNOSSC,UNDP,the African Development Bank,CGIAR ",YES,YES,,,1991,2016,Agriculture and Food Security,,SDG2,"SDG1,SDG4,SDG5,SDG17"
4,"Family Protection, Support, Security and Justice for Victims of Domestic and Gender-based Violence Programme ",https://my.southsouth-galaxy.org/en/solutions/detail/family-protection-support-security-and-justice-for-victims-of-domestic-and-gender-based-violence-programme,"The programme supported the Government of Iraq in undertaking policy, legislative, social and economic reforms to enhance the response of national institutions, improve access to justice, and empower victims of domestic violence and gender-based violence. UNDP facilitated South-South knowledge transfers, workshops and study tours to enable Iraqi authorities to learn from their Jordanian counterparts how to establish family protection systems, facilitate law enforcement and ensure access to justice for victims. UNDP supported the project as the coordinating agency in collaboration with UNICEF, UNFPA and UN-Women. The Governments of Denmark and Norway provided financial support.",IRQ ,"JOR,DNK,NOR","MENA,Europe","Implementing partners in Iraq included the Family Protection Units at the federal level and the Directorate for Tracing Violence against Women at the regional level. Other participating national partners included the Ministry of Women__ Affairs,the Ministry of Labour and Social Affairs,the Ministry of Interior,the Ministry of Human Rights,the Ministry of the Environment,the Ministry of Health,the High Council of Women in Kurdistan and civil society organizations. In Jordan,the Ministry of Social Development and the Jordanian Family Protection Department were part of the Public Security Directorate. UNDP supported the project as the coordinating agency in collaboration with UNICEF,UNFPA and UN-Women. The Governments of Denmark and Norway provided financial support. ",,,,,2012,2015,Gender Equality,Social Protection,SDG5,"SDG16,SDG17"
5,Gender-sensitive Social Protection Floors ,https://my.southsouth-galaxy.org/en/solutions/detail/gender-sensitive-social-protection-floors,"The initiative aimed to create a platform (https://socialprotection.org/) and provide social protection to vulnerable populations in developing countries, with a particular focus on women and girls. It involved providing cash transfers, food assistance, and other forms of support to those in need. By making project information available online or through events, publications and web platforms (including in particular the Global South- South Development Academy web platform, http:// academy.ssc.undp.org, and the ILO Social Protection Platform, www.social-protection.org), more countries are now learning from these experiences and findings. The project was implemented in close collaboration with United Nations resident coordinators and country teams under the auspices of UNDP/UNDG and other United Nations organizations. The direct recipients of the South-South exchanges were representatives from relevant ministries, decentralized government, social partners, social security institutions and other stakeholders involved in social protection from the participating countries. The project did this by supporting the systematic, cross-country transfer of knowledge, skills and expertise in the area of social protection. The following are some examples of how the exchanges proved fruitful. The experience of Thailand in strengthening the health protection system and extending health protection was useful for both the health insurance fund and the strategy to extend into Cambodia and the Lao People's Democratic Republic. The experiences of Brazil, India, Mongolia and others in setting up a coordination mechanism and/or single database of beneficiaries were useful for Cambodia__ social service delivery mechanism also currently being piloted. The experience of India in monitoring and evaluating protocols for social protection schemes proved useful for Cambodia__ new delivery mechanism currently being piloted. The assessment-based national dialogue tool that supports the identification of costed scenarios to extend social protection and facilitate the decision-making process was developed, tested, applied and fine-tuned through South-South exchanges. In Cambodia, national stakeholders learned from countries_ experiences in setting up a coordination mechanism following the single-window service approach (Brazil, India and Mongolia) to facilitate outreach to rural populations. A monitoring and evaluation protocol was developed based on experiences from India, which helped to strengthen the national health insurance system and staff capacity- building. In the Lao People__ Democratic Republic, exchanges were productive in supporting the extension of social health protection through the development of the Social Security Law (2013), national health insurance scheme regulations, pilot scheme technical guidelines (2015), and capacity-building of national stakeholders including the new National Social Security Fund.","LAO,KHM","THA,BRA,IND,MNG","Asia Pacific,LAC,Europe","UNOSSC,ILO,UNDG,UNDP ",,YES,,,2012,2015,"Gender Equality,Agriculture and Food Security,Governance",Social Protection,SDG2,"SDG1,SDG3,SDG8,SDG10,SDG17"
6,Rural Energy Development Programme ,https://my.southsouth-galaxy.org/en/solutions/detail/rural-energy-development-programme,"The project aimed to increase access to modern energy services in rural areas. It involved promoting the use of renewable energy sources such as solar power and biofuels, as well as increasing access to energy-efficient technologies.  This project offered a global network of expertise and experiences on which countries can draw to tackle their rural energy development challenges. It has already informed several countries in Asia (Afghanistan, Bhutan, Cambodia, Mongolia, Pakistan and Tajikistan) in various programmes relating to energy and local service delivery. Other countries, such as Kenya, Uganda and the United Republic of Tanzania, have also benefited from three-month, on-site training by Nepalese micro- hydropower experts to facilitate the replication of the approach. Danmark was a donor.","AFG,BTN,KHM,MNG,PAK,TJK,KEN,UGA,TZA","NPL,DNK","Asia Pacific,Africa,Europe","Nepal Electricity Authority,Government of Nepal,Danish International Development Agency (DANIDA),UNDP,World Bank,local banks and communities",YES,YES,YES,YES,1996,2016,Energy,,SDG7,"SDG1,SDG2,SDG17"
7,LAC Free of Child Labour Regional Initiative,https://my.southsouth-galaxy.org/en/solutions/detail/Latin-America-and-the-Caribbean-Free-of-Child-Labour-Regional-Initiative,"The project aimed to eliminate child labour in the region. It involved promoting education and training opportunities for children, as well as working with governments, employers, and civil society to improve laws and policies related to child labour. The Initiative provides an excellent platform for scaling up SSTC projects among member countries and other regions and has the potential for replication in other regions of the world. Spain and Brazil are providers, and LAC 26 states exchanged ideas and experiences. The Initiative and its technical secretariat closely coordinate with other United Nations organizations through the Regional Inter-agency Group on Child Labour, which is led by ILO and includes UNDP, UNICEF, UNESCO, UNFPA, WHO, FAO and UN-Women. In order to facilitate the exchange of good practices, the virtual platform of the Initiative includes a specific tool that maps South-South cooperation capacities of each country: http://www.oit.org.br/acelerar","ARG,BHS,BOL,BRA,CHL,COL,CRI,CUB,DOM,ECU,SLV,GRD,GTM,GUY,HTI,HND,JAM,MEX,NIC,PAN,PRY,PER,SUR,TTO,URY,VEN","ESP,BRA","LAC,Europe","Spanish Agency for Development Cooperation,Junta de Andalucía/Agencia Andaluza de Cooperación Internacional para el Desarrollo,Brazilian Cooperation Agency,ILO,UNDP,UNICEF,UNESCO,UNFPA,WHO,FAO and UN-Women. ",YES,YES,,,2013,2016,"Governance,Digitalization ","Education,Youth",SDG8,SDG17
8,Songhai Centres ,https://my.southsouth-galaxy.org/en/solutions/detail/songhai-centres,"The peoject aimed to promote sustainable agriculture and rural development in West Africa. It involved establishing training centers, with the support of  China, VietNam and Thailand, where farmers could learn about sustainable agriculture practices and business management. The Songhai model is changing the way in which rural communities in many African countries share ideas and experiences, transfer technologies and train new generations in building sustainable farming practices at the grass-roots level. It is an integrated system of development, creating and building __reen rural cities_ designed to tackle the triple challenge of environment, sustainable food production/poverty and youth unemployment, and reversing rural exodus. The technologies used are developed through cooperation with China, Thailand and Viet Nam and many African universities and institutions.The Songhai model is being replicated in 15 African countries, building on its growing numbers of incubated entrepreneurs who reinvest in their communities to create new opportunities. ","BFA,TCD,CHN,COD,GNQ,GMB,GHA,GIN,LBR,MWI,NGA,COG,SEN,SLE,THA,TGO,VNM,BEN","VNM,CHN,THA","Asia Pacific,Africa,Europe","Governments,private sector,Eliminate Poverty NOW,French Development Agency,FAO,IFAD,ILO,Songhai Centre,Songhai Women__ Capital Fund,UNDP,USAID",YES,YES,,,1985,2016,Agriculture and Food Security,,SDG2,"SDG2,SDG15,SDG17"
9,Viet Nam Cleaner Production Centre ,https://my.southsouth-galaxy.org/en/solutions/detail/vietnam-cleaner-production-centre,"The project aimed to promote environmentally sustainable industrial development in Vietnam. It involved providing technical assistance and training to businesses on how to reduce their environmental impact and improve their efficiency. The Vietnam Cleaner Production Centre uses South-South technical exchanges to develop local capacities and bolster local institutions while it tests and adapts concepts from other countries. A strong capacity-building and training component ensures the assimilation and long- term sustainability of projects. The Centre also functions as a research and reference institution for the dissemination of best practices and learning. The Centre helps to strengthen national regulatory frameworks, for example, through the introduction of cleaner production laws and by establishing national centres of excellence in Cambodia, Lao People__ Democratic Republic and Vietnam.Through its activities in capacity-building and Resource Efficient and Cleaner Production (RECP) assessments in Cambodia and the Lao People__ Democratic Republic, it has helped to start up RECP centres in these two countries.","KHM,LAO,VNM",VNM ,Asia Pacific,"Main partners include local industries,small and medium-size enterprises,academia,ministries of industry,UNIDO,UNDP,UNEP,ILO,Switzerland,the European Union,SWITCH-Asia,RECPnet,B_CH KHOA,Hanoi University of Science and Technology,and industrial associations in Vietnam. Some of the partners are clients,donors or facilitators in approaching industries and in offering capacity-building courses.",YES,YES,,,1998,2016,"Environment,Governance",,SDG9,"SDG1,SDG2,SDG13,SDG17"
10,Saudi Youth Exchange Programme ,https://my.southsouth-galaxy.org/en/solutions/detail/saudi-youth-exchange-programme,"The project aimed to promote cross-cultural exchange and understanding among young people in Saudi Arabia. It involved facilitating exchange programs between young people from different regions of the country. This project maintained connections with and among these future leaders could be important for future South-South cooperation partnerships and strategic collaborations. Also, the outcome document from the programme serves as a basis for other potential South-South and triangular cooperation initiatives on specific topics of bilateral interest among countries. 10 youth exchange visits took place with various countries (Brazil, China, India, the Republic of South Korea, Spain and the United Republic of Tanzania).",SAU,"BRA,CHN,IND,KOR,ZAF,TZA ","MENA,Asia Pacific,Africa,LAC","UNDP,Government of Saudi Arabia,the Private sector",YES,YES,YES,,2010,2016,Governance,,SDG10,"SDG1,SDG11,SDG16,SDG17"
11,China__ One-stop Service Centre Model: Designing Government Services for Urban Bangladesh ,https://my.southsouth-galaxy.org/en/solutions/detail/chinas-one-stop-service-centre-model,"Apart from streamlining government services and improving efficiency, the project also included a significant digitalization component.This aspect aimed to leverage technology to enhance the accessibility and convenience of government services for citizens. Bangladesh conducted South-South exchanges with China in 2013 to learn from and adapt its innovative one-stop social service centre model. UNDP facilitated and coordinated experts from Malaysia and Singapore.",BGD,"CHN,MYS,SGP",Asia Pacific,"UNDP,four mayors from Bangladesh,city administrations ",,YES,YES,,2013,2014,"Digitalization,Governance ",,SDG11,SDG17
12,Energy-efficiency Standards and Labelling ,https://my.southsouth-galaxy.org/en/solutions/detail/Energy-Efficiency-Standards-and-Labelling,"The project aimed to promote the use of energy-efficient appliances and equipment. It involved setting standards for energy efficiency and labeling products so that consumers could make informed choices about the products they buy. Bangladesh, Indonesia and Pakistan, which initially had no or limited Energy-efficiency Standards and Labelling (ESL) activities, benefited from the project__ South-South knowledge and lessons learned, capacity-building activities and tools on ESL developed by countries with greater accumulated experiences, primarily China but also Thailand and Viet Nam.","BGD,IDN,PAK","CHN,THA,VNM",Asia Pacific,"UNDP,GEF Small Grants Programme",,YES ,YES,,2009,2013,Energy,,SDG12,SDG17
13,Caribbean Risk Management Initiative ,https://my.southsouth-galaxy.org/en/solutions/detail/Caribbean-Risk-Management-Initiative,"The project aimed to improve disaster risk management in the Caribbean. It involved developing plans and policies to reduce the impact of natural disasters, as well as providing training and resources to help communities prepare for and respond to disasters. UNDP helped Cuba to replicate its experience in other countries (Dominican Republic, Guyana, Jamaica, Trinidad and Tobago, British Virgin Islands). This South-South cooperation initiative has proved successful and adaptable in all participating countries while taking into consideration their local contexts. ","DOM,GUY,JAM,TTO,VGB",CUB,LAC,UNDP,,,YES,,2011,2015,Resilience,Risk Management,SDG13,"SDG11,SDG17"
14,Benguela Current Commission ,https://my.southsouth-galaxy.org/en/solutions/detail/Benguela-Current-Commission,"The project aimed to promote the sustainable management and conservation of the Benguela Current marine ecosystem by fostering regional cooperation among Angola, Namibia, and South Africa. The commission facilitated collaboration among governments, scientists, and stakeholders to enhance the understanding of the ecosystem, promote sustainable fisheries, and address climate change impacts. Government leaders from Angola, Namibia and South Africa have jointly established the transboundary Benguela Current Commission to promote a coordinated regional approach to the long-term conservation. It is considered an outstanding model of South-South cooperation that benefits countries throughout the region. Other regions and countries have already picked up on the Benguela example, such as the Humboldt Current Large Marine Ecosystem Project, the African large marine ecosystem projects (for the Canary, Guinea, Agulhas and Somali currents), the fisheries refugia in the South China Sea, and the Global Ballast (GloBallast) Water Management Programme. The replication of the model hinges on close cooperation and the funding of participating countries.","AGO,NAM,ZAF","AGO,NAM,ZAF",Africa,"Global Environment Facility (GEF),UNDP,Benguela Current Commission and participating countries",,YES ,,,2013,,Environment,,SDG14,SDG17
15,Regional Initiative for Capacity Enhancement in South Sudan ,https://my.southsouth-galaxy.org/en/solutions/detail/regional-initiative-for-civil-service-capacity-enhancement-in-south-sudan,"The project aimed to enhance the capacity of civil servants in South Sudan by providing training and technical assistance in key areas such as public financial management, procurement, and human resource management; and supported the development of a professional and competent civil service that can effectively deliver services to the citizens. Ethiopia, Kenya and Uganda deployed to South Sudan 200 civil servants in key functions identified by the Government of South Sudan. This was an example of triangular-organized, donor-supported South-South cooperation in coaching and mentoring for civil service capacity. The model has been gradually promoted for fragile states (IGAD countries). ","ETH,KEN,UGA","SSD,NOR,USA,DEU","Africa,Europe,North America","Norway,Intergovernmental Authority on Development,Government of South Sudan,UNDP South Sudan,USAID,German Agency for International Development (GIZ),Kenya ",,YES,YES,,2010,2018,Governance,,SDG16,SDG17
16,Digital Centres ,https://my.southsouth-galaxy.org/en/solutions/detail/digital-centres,"The project aimed to promote digital inclusion and access to information and communication technologies (ICTs) in developing countries by establishing digital centers in rural and underserved areas, by learning from Bangladesh (a2i). The initiative aimed to bridge the digital divide and promote economic and social development by providing access to ICTs, training, and digital services. Government and non-government agencies from the Maldives, Bhutan and Fiji have already entered into partnerships with a2i to replicate some of its successful initiatives, including the digital centre initiative. ","MDV,BTN,FJI",BGD,Asia Pacific,"Government of Bangladesh,UNDP and USAID,Access to Information (a2i) Programme",YES,YES,,,2010,2018,"Digitalization,Governance ",,SDG1 ,SDG17
17,TRANSFORM ,https://my.southsouth-galaxy.org/en/solutions/detail/TRANSFORM,"The primary objective of TRANSFORM was  to build critical thinking and capacities of policymakers and practitioners at national and decentralized levels to improve the design, effectiveness and efficiency of social protection systems. This is achieved through South-South cooperation and peer learning among experts from participating countries (Ethiopia, Ghana, Kenya, Lesotho, Malawi, Mauritius, Mozambique, South Africa, the United Republic of Tanzania, Zambia, and Zimbabwe), academia; ILO, UNICEF, UNDP, IPC-IG, Irish Aid and EU-SPS contributed to capacity development programmes.The first TRANSFORM Training of Trainers was conducted in October 2017 in Zambia. The 23 trainers represented government, academia, the private sector and the UN system from Ethiopia, Ghana, Kenya, Lesotho, Malawi, Mauritius, Mozambique, South Africa, the United Republic of Tanzania, Zambia, and Zimbabwe. Participants were selected through a call for applications distributed through TRANSFORM regional partners_ networks. To obtain certification, trainers first participated in the training. In the second step, they provided a training themselves, with the support of the head trainers. This will enable the creation of a pool of trainers across Africa. A community of regional TRANSFORM trainers will facilitate interactions among Southern countries.","ETH,GHA,KEN,LSO,MWI,MUS,MOZ,ZAF,TZA,ZMB,ZWE","ETH,GHA,KEN,LSO,MWI,MUS,MOZ,ZAF,TZA,ZMB,ZWE",Africa,"African Union,UNICEF,UNDP,ILO,IPC-IG,EU-SPS,Irish Aid,Southern Africa Social Protection Experts Network-SASPEN",YES,YES,YES,,2015,2020,Poverty and Inequality,,SDG1 ,"SDG3,SDG5,SDG8,SDG10,SDG17"
18,Cuba and the Pacific: Fostering Organic Agriculture Across the Ocean ,https://my.southsouth-galaxy.org/en/solutions/detail/cuba-and-the-pacific,"The project aimed to promote South-South cooperation between Cuba and Pacific island countries in the areas of health, education, and disaster response. The initiative facilitated the exchange of knowledge and expertise to enhance the capacity of Pacific island countries to address their development challenges. During the training, El Salvador, Fiji, Guatemala and the Solomon Islands learned from Cuba on future South- South cooperation in the areas of organic farming, sustainability and resilience development in the fragile ecosystems of small island developing States. ","SLV,FJI,GTM,SLB",CUB,"LAC,Asia Pacific","UNDP,GEF Small Grants Programme and Pacific Organic and Ethical Trade Community (POETCom)",,YES,,,2015,2017,"Health,Resilience,Environment,Agriculture and Food Security ",Education,SDG2,"SDG3,SDG17"
