219,Regional Initiative for Capacity Enhancement in South Sudan ,https://my.southsouth-galaxy.org/en/solutions/detail/regional-initiative-for-civil-service-capacity-enhancement-in-south-sudan,"The project aimed to enhance the capacity of civil servants in South Sudan by providing training and technical assistance in key areas such as public financial management, procurement, and human resource management. It supported the development of a professional and competent civil service capable of effectively delivering services to the citizens. This was achieved through the deployment of 200 civil servants from Ethiopia, Kenya, and Uganda to South Sudan in key functions identified by the Government of South Sudan. This triangular-organized, donor-supported South-South cooperation model focused on coaching and mentoring for civil service capacity. The deployments served as a capacity boost, facilitating the development of local capacity through peer-to-peer coaching partnerships with South Sudanese counterparts. During the project's first phase, technical support was provided for institutional strengthening by formulating legal, regulatory, and policy frameworks. This included the enactment of regulations governing the conduct of business by the National Legislative Assembly. Additionally, the project helped harmonize and develop sectoral policies to support various Ministries in South Sudan. The model of triangular-organized, donor-supported South-South cooperation in coaching and mentoring for civil service capacity has been gradually promoted for fragile states, recognizing the benefits of involving neighboring countries with cultural and linguistic affinity, as well as knowledge of local and regional conditions. Moreover, the Initiative offers a cost-effective approach, with an average cost of around $50,000 per civil service support officer per year, encompassing all project expenses.",SSD,"SSD,NOR,USA,DEU,ETH,KEN,UGA","Africa,Europe,North America","Norway,Intergovernmental Authority on Development (IGAD),Government of South Sudan,UNDP South Sudan,USAID,German Agency for International Development (GIZ),Kenya,Ethiopia,and Uganda,IGAD",,YES,YES,,2010,2020,Governance,,SDG16,SDG17
220,"Project for Strengthening Technical and Functional Skills of Supreme Audit Institutions, National Parliaments and Civil Society for the Control of Public Finances",https://my.southsouth-galaxy.org/en/solutions/detail/strengthening-the-technical-and-functional-skills-of-supreme-audit-institutions-national-parliaments-and-civil-society-for-the-control-of-public-finances-in-portuguese-speaking-african-countries-and-timor-leste,"Since 2014, the European Development Fund (EDF), National Authorizing Officers (NAO) of Timor-Leste and the African countries using Portuguese as an official language (PALOP), in coordination with the European Union, have had a partnership with UNDP to strengthen good economic governance. The project is working to ensure sustainable access to existing databases and information in Portuguese. The project aimed to strengthen the capacity of supreme audit institutions, national parliaments, and civil society organizations in PALOP (Portuguese-speaking African countries: Angola, Cape Verde, Guinea-Bissau, Mozambique and São Tomé and Príncipe) and Timor-Leste to enhance public financial management and accountability.The project will contribute to establishing a multi-country civil society organization (CSO) platform for PALOP and Timor-Leste, showcasing lessons learned and progress made by CSOs within the Community of Portuguese Language Countries Open Budget Initiative. The initiative provided training, technical assistance, and knowledge sharing to improve the efficiency and effectiveness of public financial management and enhance transparency and accountability.During the project, participating countries (Angola, Cabo Verde, Guinea- Bissau, Mozambique, Sao Tome and Principe, and Timor-Leste) developed synergies and dynamics through the exchange of experiences, joint learning and South-South cooperation that involve partners in different countries. The initiative__ main partners include PALOP as well as Timor-Leste. Institutions in Brazil and Portugal, in particular the Court of Auditors and Parliament, are technical partners in the delivery of relevant actions. Financial and technical support comes from the European Union and UNDP, and the latter is also the implementing partner and the project__ implementing entity. ","AGO,CPV,GNB,MOZ,STP,TLS","DEU,BRA,PRT","LAC,Africa,Asia Pacific,Europe","EU,UNDP,Germany,The initiative__ main partners include PALOP as well as Timor-Leste. Institutions in Brazil and Portugal,in particular the Court of Auditors and Parliament,are technical partners in the delivery of relevant actions. Financial and technical support comes from the European Union and UNDP,and the latter is also the implementing partner and the project__ implementing entity. The initiative also promotes collaboration and technical coordination with expert organizations such as the World Bank,AGORA,the Inter-Parliamentary Union,the German Agency for International Cooperation (GIZ),the Conseil régional de formation des institutions supérieures de contrôle des finances publiques d__frique francophone subsaharienne,the International Budget Partnership,OISC/CPLP,the INTOSAI Development Initiative and the African Organization of English-speaking Supreme Audit Institutions.",,YES,YES,,2014,2017,Governance,,SDG16,SDG17
221,UN-REDD Programme ,https://my.southsouth-galaxy.org/en/data/un-redd-programme,"The project aimed to reduce emissions from deforestation and forest degradation and promote sustainable forest management in developing countries.The Programme supports nationally led REDD+ processes and promotes the informed and meaningful involvement of all stakeholders, including indigenous peoples and other forest-dependent communities, in national and international REDD+ implementation. Additionally, the programme supports national REDD+ readiness efforts in 65 partner countries, spanning Africa, Asia-Pacific and Latin America through SSTC.","BEN,CMR,CAF,TCD,COD,COG,CIV,GNQ,ETH,GAB,GHA,GIN,GNB,KEN,LBR,MDG,MOZ,NGA,SSD,SDN,TZA,TGO,UGA,ZMB,ZWE,BGD,BTN,KHM,FJI,IND,IDN,LAO,MYS,WSM,SLB,LKA,THA,TLS,VUT,VNM,ARG,BOL,BRA,CHL,COL,CRI,DOM,ECU,SLV,GTM,GUY,HND,JAM,MEX,PAN,PRY,PER,SUR,URY",,"Africa,Asia Pacific,LAC","FAO,UNDP",,YES,,,2018,2020,"Environment,Agriculture and Food Security",,SDG2,"SDG13,SDG17"
222,Transboundary Water Cooperation for Sustainable Development in African Basins and Globally Facilitated through the Water Convention,https://my.southsouth-galaxy.org/en/solutions/detail/transboundary-water-cooperation-for-sustainable-development-in-african-basins-and-globally-facilitated-through-the-water-convention,"The project facilitated cooperation between African countries to promote sustainable water management and the conservation of shared water resources. Global and regional workshops under the Convention, for example, on transboundary water cooperation in Africa, support a South-South capacity-building approach to accelerate progress towards the SDGs. For example, the 2019 __ractitioner to Practitioner:  Regional Training on Promoting Implementation to Two Global Water Conventions_ workshop, organized by UNECE together with partners targeting experts active in Francophone countries in West, North and Central Africa, fostered a common understanding on the practical benefits of both the Water Convention and the Convention on the Law of Non-Navigational Uses of International Watercourses (commonly referred to as the Watercourses Convention), collectively known as the United Nations global water conventions. As another example, in 2017, in partnership with the World Bank, the African Development Bank, the European Investment Bank and the Senegal River Basin Development Organization, the Convention secretariat organized a training in Dakar on preparing bankable project proposals for climate change adaptation in transboundary basins, where experts from Africa, Asia and Eastern Europe exchanged experiences. The first report on the global baseline for SDG indicator 6.5.2 published in 2018 demonstrated that the highest level of cooperation can be found in the Pan-European region, largely facilitated by the Water Convention, followed by West and Southern Africa, including, for example, Senegal, the Gambia, Volta and Niger Rivers. Based on a request by Senegal at the Water Convention__ Meeting of the Parties in 2018, UNECE, together with the Geneva Water Hub, initiated a dialogue in 2019 on the SMAB between the Republic of the Gambia, Guinea-Bissau, Mauritania and Senegal, which aims to strengthen cooperation and sustainable use of the aquifer and is still ongoing. ","SEN,GMB,GNB,MRT ","SEN,GMB,GNB,MRT,CHE","Africa,Europe","UNDP,United Nations Environment Programme (UNEP),United Nations Educational,Scientific and Cultural Organization (UNESCO),United Nations Economic Commission for Africa (ECA),United Nations Economic and Social Commission for West Asia (ESCWA),African Ministers_ Council on Water (AM- COW),Economic Community of Central African States (ECCAS),Economic Community of West African States (ECOWAS),Geneva Water Hub,and many others.",,YES,,,2016,,Environment,,SDG6,"SDG1,SDG7,SDG8,SDG9,SDG11,SDG12,SDG13,SDG14,SDG15,SDG16,SDG17"
223,__-voluir_ (__-volve_) Innovation journey ,https://my.southsouth-galaxy.org/en/solutions/detail/the-e-volve-e-voluir-innovation-journey,"The project aimed to addressing the socioeconomic impacts of COVID-19 in Portuguese-speaking African countries through innovation and South-South cooperation E-volve (E-voluir) was an innovation competition and programme that put forward creative solutions to development challenges exacerbated by the COVID-19 pandemic. Fábrica de Startups Brasil, a business accelerator, implementing the project across the PALOPs with full financing from UNDP in Guinea-Bissau and technical support from UNDP country offices in Angola, Cabo Verde, Mozambique and São Tomé e Príncipe, as well as from Guinea-Bissau. The competition was an opportunity for citizens of the PALOPs to come forward and propose ideas and solutions to socioeconomic problems affecting their communities, mainly in areas related to: (i) work and economy; (ii) e-governance and digital transformation; (iii) disaster risk reduction; and (iv) community resilience.The initiative attracted more than 1,000 applications in the ideation phase from young professionals and graduate students from both PALOP resident nationals and members of the diasporas. Ten teams were eventually selected, each composed of three to four participants. In partnership with Fábrica de Startups Brasil, E-volve provided support to the selected startups, starting with an intensive ideation week for the development of solutions in February 2021. The ideation week was followed by a 20-week acceleration programme, during which the winning teams were joined by ten early-stage startups from the PALOPs that already work on similar challenges. Throughout E-volve, participating teams were put in contact with mentors and possible funding and technical partners. The initiative has shown that, even during a pandemic, it is possible to organize an online innovation journey, focusing on network development and on South-South cooperation. Although the initiative dealt with immediate solutions to the COVID-19 crisis, it also has potential long-term impacts, including the intensification of South-South cooperation among the PALOPs through exchanges of best practices and strengthening of Lusophone entrepreneurship ecosystems and innovation networks.","AGO,CPV,MOZ,STP,GNQ","BRA,GNB ","Africa,LAC","UNDP in Angola,Cabo Verde,Guinea-Bissau,Mozambique,and São Tomé and Príncipe,Disruption Lab,Djassi Africa,Fábrica de Startups Brasil",YES,YES,YES,YES,2020,2021,"Digitalization,Governance,Poverty and Inequality,Resilience",Job Creation,SDG9,"SDG1,SDG8,SDG17"
224,Yemeni Dukkan E-commerce platform,https://my.southsouth-galaxy.org/en/solutions/detail/yemeni-dukkan-e-commerce-platform,"The project aimed to support Yemeni entrepreneurs, particularly women, by providing them with a platform to sell their products online and access new markets.""A2i from Bangladesh, with the assistance from UNDP Yemen, implemented the e-commerce platform and its related services in Yemen.a2i and its ekShop initiative have extensive experience in replicating the e-commerce module in two countries, Türkiye and South Sudan.","YEM,TUR,SSD",BGD,Asia Pacific,"UNDP Yemen (ERRY Project),ekShop,Bangladesh - Aspire to Innovate (a2i) programme,ICT Division and the Cabinet Division of the Government of Bangladesh Supported by UNDP Bangladesh",YES,YES,YES,,2021,,"Gender Equality,Digitalization",,SDG8,"SDG9,SDG10,SDG17"
225,The Facilitation of the Achievement of Sustainable National Energy Targets of Tuvalu (FASNETT) - Output ID: 00091772, https://www.undpopenplanet.org/projects/Facilitation_of_the_Achievement_of_Sustainable_National_Energy_Targets_of_Tuvalu_FASNETT/ ,"The Facilitation of the Achievement of Sustainable National Energy Targets of Tuvalu (FASNETT) project aims to develop and utilize renewable energy resources and energy efficiency technologies in Tuvalu. With support from the India UN-Development Partnership Fund, UNDP supported the Ministry of Transport, Energy, and Tourism (MTET) of the Government of Tuvalu in launching the Solar Home Systems (SASH) project. The objective is to provide electricity to households in Funaota through standalone solar home systems. Due to the COVID-19 crisis, the SASH project faced budget constraints, but FASNETT project bridged the funding gap and incorporated the Standalone Solar for Funaota as an additional demonstration activity. The cooperation between the two projects served as an example of mutual benefit. The project received financial support from India, Australia, New Zealand, Korea, UK, Japan, and Romania. Funding for the project comes from the GEF, UNDP, the Government of Tuvalu, and Tuvalu Electricity Corporation.",TUV,"IND,AUS,NZL,KOR,GBR,JPN,ROU","Asia Pacific,Europe","UNDP,GEF,GCF,Government of India,Australia,New Zealand,Korea,UK,Japan and Romania",,YES,YES,YES,,,"Energy,Health,Energy",,SDG7,"SDG3,SDG17"
226,South-South partnership between the Bureau Géologique des Comores (BGC) and the African Center for Mineral Sciences and Earth (AMGC) ,,"With the support of the Mining Resource Service of the UNDP Regional Office (Addis Ababa), the South-South partnership between the Bureau Géologique des Comores (BGC) and the African Center for Mineral Sciences and Earth (AMGC), was restarted. Discussions on the establishment of a program to develop a geological mapping for the Comoros, have been initiated. A proposal for a project is being prepared jointly by AMGC and BGC. ""The same meaning on the basis of the agreement signed in 2020, the partnership between the BGC and the company Kenyan Geothermal Development Company (GDC) returns to its implementation phase with the project's business plan update, which will reduce the risk of the project. Comoros has political, legal and regulatory framework for promoting development of renewable energies.",COM,KEN,Africa,"African Minerals and Geosciences Centre,Government of Comoros",YES,YES,YES,,,,Energy,,SDG7,SDG17
227,"__uilding trust and confidence in Zimbabwe__ Transition_ Project, learning from South Africa",https://erc.undp.org/evaluation/documents/detail/19547,"The project ""Building trust and confidence in Zimbabwe's Transition"" was a joint program among UNDP, UN WOMEN, and UNICEF. It aimed to develop a common framework for implementing the peace architecture in the country. The project, facilitated by UNDP Zimbabwe, sought technical advice from the Humanitarian Dialogue in Kenya to assist the National Peace and Reconciliation Commission (NPRC) in Zimbabwe in establishing the Conflict Early Warning and Early Response (CEWER) system. This technical assistance played a crucial role in shaping the discourse on the development of indicators and the selection of a contextualized prototype system for Zimbabwe. Moreover, the NPRC benefited from the experience of South Africa in conducting public hearings. A former commissioner of the South African Truth and Reconciliation Commission shared knowledge and lessons with the NPRC. These lessons focused on various aspects such as the development of training manuals, the methodology for conducting public hearings, and the establishment of information storage and security facilities. This valuable knowledge, along with provincial stakeholder consultations, has informed the NPRC's policy on public hearings. This collaboration between different UN agencies, as well as the sharing of experiences with South Africa, exemplifies the spirit of SSC in fostering peace and reconciliation efforts in Zimbabwe.",ZWE,"KEN,ZAF",Africa,"UNDP,UN Peacebuilding Fund (PBF)  ",,,YES,,,,"Governance,Resilience",,SDG16,SDG17
228,UNDP Africa Sustainable Finance Hub (ASFH)'s support to SSTC,,"Several online inter-regional South-South events (symposium, workshops, etc.) were organized by ASFH in 2020 with the participation of about 40 African countries. They served as SSC platforms for peer-learning and exchanging ideas and good practices on enhancing domestic revenue mobilization, boosting remittances, and strengthening SSC institutionalization for African countries in the COVID-19 context and beyond. Examples included: the regional taxation symposium __nhancing Domestic Revenue Mobilization for Sustainable Development in Africa-Dialogue on Taxation, Social Contract and Post COVID-19 Recovery Strategy; and a regional south-south workshop on remittances in 2020: Boosting remittances in the current COVID-19 context and beyond. ",,,Africa,UNDP,,,,,2020,,Health,,SDG17 ,SDG3
229,"Enhancing Domestic Revenue Mobilization for Sustainable Development in Africa: Dialogue on Taxation, Social Contract and Post COVID-19 Recovery Strategy",,"African countries face challenges in collecting due tax revenue, including low tax morale, inefficient administration, tax avoidance/evasion, and dependence on natural resource revenue. These challenges limit their ability to use taxes effectively for COVID-19 mitigation and sustainable development.UNDP and AfronomicsLaw organised an event to discuss taxation in Africa, focusing on trends, challenges, and solutions for effective revenue mobilization. The outcome informed UNDP's support to governments and guide regional and global taxation efforts. The webinar, ""Enhancing Domestic Revenue Mobilization for Sustainable Development in Africa: Dialogue on Taxation, Social Contract and Post COVID-19 Recovery Strategy"" held on 10, November, 2020 counted with the participation and discussions on taxation from Togo, Honduras, Maldives, South Africa, Jamaica, Zambia, Uganda, and Finland. Representatives and officials from these countries shared their insights, experiences, and recommendations on various tax-related issues and reforms. The UNDP Africa Finance Sector Hub plans to collect these recommendations to develop a continent-wide project to support countries in enhancing domestic revenue mobilization for the realization of the SDGs.","TGO,HND,MDV,ZAF,JAM,ZMB,UGA,FIN","TGO,HND,MDV,ZAF,JAM,ZMB,UGA,FIN","Africa,LAC,Europe,Asia Pacific","African tax policy makers and officials,Regional organization representatives,including African Tax Administration Forum (ATAF),Researchers and academics,International development partners,UNDP Country Offices representatives,Civil societies and interest groups,such as Tax Justice Network Africa (TJNA),International Budget Partnership (IBP),AfronomicsLaw,Government of Togo,Honduras,Maldives,South Africa,Jamaica,Zambia,Uganda,and Finland.",YES,YES,YES,,2020,2020,"Governance,Poverty and Inequality",,SDG16,"SDG1,SDG17"
230,Boosting Remittances in the Current COVID-19 Context and Beyond,,"The UNDP Finance Sector Hub supports African countries in finding innovative financing solutions through Development Finance Assessments (DFAs). Remittances and diaspora engagement have emerged as untapped financing flows. The South-South Virtual Seminar ""Boosting Remittances in the current COVID-19 context and beyond"" aimed to understand remittance challenges, explore opportunities for COVID-19 recovery and sustainable development financing, and generate dialogue. Inputs gathered would inform the development of UNDP's FSH Africa Regional Project on Remittances in Africa. To understand remittance challenges, engage stakeholders, promote dialogue, and develop a roadmap for UNDP's FSH Africa Regional Project, representatives from the United Kingdom, the United States of America, Ethiopia, Benin, Moldova, Mexico, Nigeria, Cabo Verde, Kenya, and the Philippines shared their experiences and perspectives.  IOM, UNECA, UNCDF, World Bank also presented during the meeting. ","GBR,USA,ETH,BEN,MDA,MEX,NGA,CPV,KEN,PHL","GBR,USA,ETH,BEN,MDA,MEX,NGA,CPV,KEN,PHL","Asia Pacific,North America,Europe,LAC","Government officials _ policy makers,regulators and investment promotion,Fintech Industry-connecting MNO (mobile network operator) and MTO,Diaspora associations and government departments,Academia/Experts on Diaspora and remittances,International Development Partners and International Finance Institutions,UNDP Country Offices representatives,IOM,UNECA,UNCDF,World Bank,GIZ.",YES,YES,YES,,2020,2020,"Governance,Poverty and Inequality",,SDG16,"SDG1,SDG17"
231,Africa INFF and Open Budgets Workshop ,https://inff.org/event/integrated-national-financing-frameworks-and-open-budgets-for-sustainable-development-in-africa-2022,"The objectives of the project included strengthening the capabilities of government officials, UN staff, and other stakeholders in areas such as SDGs Financing Dialogues, Financing Strategies, and budget openness. It also aims to promote knowledge-sharing among countries, facilitating discussions on lessons learned and best practices. Additionally, the project sought to generate a regional dialogue to address emerging trends and issues that impact the implementation of Integrated National Financing Frameworks (INFFs) and open budget reforms. During the session, representatives from Botswana, Burkina Faso, Guinea, Comoros, Nigeria, Malawi, Tanzania, Gabon, Mozambique, Zimbabwe Eswatini, Rwanda, Mauritius, Ghana, Sierra Leone, Kenya, Gambia, Côte d'Ivoire, Benin, Uganda, Zimbabwe shared national experience and progress with other participant countries. ","BWA,BFA,GIN,COM,NGA,MWI,TZA,GAB,MOZ,ZWE,SWZ,RWA,MUS,GHA,SLE,KEN,GMB,CIV,BEN,UGA","BWA,BFA,GIN,COM,NGA,MWI,TZA,GAB,MOZ,ZWE,SWZ,RWA,MUS,GHA,SLE,KEN,GMB,CIV,BEN,UGA",Africa,"ECA,UNDP,UNDESA,UNICEF,and the International Budget Partnership,Government of Botswana,Burkina Faso,Guinea,Comoros,Nigeria,Malawi,Tanzania,Gabon,Mozambique,Zimbabwe Eswatini,Rwanda,Mauritius,Ghana,Sierra Leone,Kenya,Gambia,Côte d'Ivoire,Benin,Uganda,Zimbabwe",YES,YES,YES,,2022,2022,"Governance,Poverty and Inequality",,SDG16,"SDG1,SDG17"
232,Morocco 4C - Blue Congo Basin Fund,"https://www.ndcs.undp.org/content/ndc-support-programme/en/home/impact-and-learning/case-studies/morocco-4c-blue-congo-bassin-fund.html#:~:text=The%20Blue%20Congo%20Basin%20Fund,largest%20rainforest%20of%20the%20world.","2020 saw the culmination of the foreshadowing study of the Blue Fund for the Congo Basin, the result of UNDP Morocco's support to the Climate Change Competence Center (4C Morocco) as part of a SSC agreement between the Kingdom of Morocco and the Congo Basin Climate Commission. The study, allowed to identify a pipeline of more than 250 structuring projects stemming from the 24 sectoral programs of the Blue Economy and Nationally Determined Contributions (CDN), valued at about US $ 9 billion, and on the other hand, to define the financial mechanism of the Fund and its governance model. The pre-feasibility study was reviewed at two stakeholder meetings in October and November 2019 in Brazzaville, where representatives from all participating countries met: Angola, Burundi, Cameroon, Central African Republic, Chad, Democratic Republic of Congo, Equatorial Guinea, Gabon, Kenya, Republic of Congo, Republic of Rwanda, Sao Tome & Principe, South Sudan, Tanzania, Uganda, Zambia.","AGO,BDI,CMR,CAF,TCD,COD,GNQ,GAB,KEN,COG,RWA,STP,SSD,TZA,UGA,ZMB","MAR,DEU","Africa,Europe"," Climate Change Competence Center (4C Morocco),Congo Basin Climate Commission,Government of Gernmany",YES,,YES,,2015,Present,"Environment,Poverty and Inequality",,SDG13,SDG17
233,"UNDP Oslo Governance Center's support to SSTC for capacity building, peer exchanges and knowledge brokering around SDG16",https://www.undp.org/policy-centre/oslo Include link from UNDP Oslo Gov. Center,"UNDP__ Oslo Governance Centre has been leveraging SSTC for capacity building and knowledge brokering around SDG 16 indicators within the international statistical community. supporting online exchanges through the SDG16 Hub to enable discussion and exchange of lessons and experiences between peers. Online discussion forums and virtual regional trainings on SDG 16 indicator measurement were organized by the Oslo Center with other UN entities, which also encouraged peer learning, such as the workshop for African NSOs in November and December in 2020, and  similar events for NSOs in Latin America and in Asia. The Center is leveraging existing experience in UNDP with the measurement of SDG indicators to promote peer-exchange on data collection methods between countries, particularly on innovative and emergent practices.",,,"Africa,LAC,Asia Pacific",UNDP,,,YES,,,,Governance,,SDG16,SDG17
